{
  "$schema": "https://json-schema.org/draft/2020-12/schema",
  "$id": "https://bicameral-ai.com/schemas/connector-config.schema.json",
  "title": "Connector config descriptor",
  "description": "Machine-readable per-connector configuration contract consumed by the mcp UI. Holds requirements/permissions/instructions only — never secret values (secrets stay in the operator runtime via SecretResolver). Structural rules live here; the semantic rules (id==source_id, modes subset of capabilities, conditional instructions[].ref) are enforced by scripts/validate_connector_config.py.",
  "type": "object",
  "additionalProperties": false,
  "required": ["id", "name", "version", "channel", "description", "category", "trust_tier", "status", "available", "modes", "credentials", "data", "instructions", "references"],
  "properties": {
    "id": {"type": "string", "description": "Stable connector id; equals the folder name AND the connector's source_id."},
    "name": {"type": "string", "description": "Human display name."},
    "version": {"type": "string", "description": "Per-connector semver (MAJOR.MINOR.PATCH). Baseline 0.1.0; bumps when the emission/contract shape changes. Distinct from the schema $id (which versions the descriptor contract) and from channel/status."},
    "channel": {"type": "string", "enum": ["beta", "ga"], "description": "Product release channel — UNIFORM across all connectors + mods until GA. The whole product is Beta; connector status is a separate implementation/packaging maturity signal and does not imply alpha admission, gateway proof, terminal proof, or human acceptance. The validator enforces channel equals the single product channel."},
    "description": {"type": "string", "description": "One-line summary for the UI connector card."},
    "icon": {"type": "string", "description": "Optional icon/logo slug for the UI."},
    "category": {"type": "string"},
    "trust_tier": {"type": "string"},
    "status": {"type": "string", "enum": ["scoped", "candidate", "beta", "live-ready"], "description": "Connector implementation/packaging maturity only. `live-ready` means the connector can be wired by an operator; it does NOT mean Live, alpha-admitted, gateway-proven, terminally proven, or human accepted. Alpha/conformance truth lives in the alpha ingest manifest and downstream acceptance records."},
    "available": {"type": "boolean", "description": "Canonical 'show as available vs coming-soon' flag the UI keys off. Availability is presentation/configurability, not proof of alpha admission or runtime conformance."},
    "modes": {"type": "array", "items": {"type": "string", "enum": ["webhook", "active", "passive"]}},
    "credentials": {
      "type": "array",
      "items": {
        "type": "object",
        "additionalProperties": false,
        "required": ["key", "type", "label", "required", "obtain"],
        "properties": {
          "key": {"type": "string", "description": "The SecretResolver key (source_id, or a namespaced key for multi-credential connectors)."},
          "type": {"type": "string", "enum": ["api_key", "oauth2", "webhook_secret", "basic"]},
          "label": {"type": "string"},
          "required": {"type": "boolean"},
          "modes": {"type": "array", "items": {"type": "string", "enum": ["webhook", "active", "passive"]}, "description": "Which run modes this credential serves. ABSENT or EMPTY = all modes (the runner requires it on any run). A mode-scoped run requires only credentials serving that mode."},
          "header": {"type": "string", "description": "How the credential is presented on the wire (e.g. 'Authorization (raw, no Bearer)')."},
          "scopes": {"type": "array", "items": {"type": "string"}, "description": "OAuth2 scopes."},
          "refresh_owner": {"type": "string", "enum": ["operator"]},
          "wiring_oversight": {"type": "boolean", "description": "True when the credential's wiring (e.g. OAuth token exchange/refresh) needs operator oversight beyond the UI."},
          "validation": {"type": "string", "description": "Optional regex/format hint to catch paste errors."},
          "obtain": {
            "type": "object",
            "additionalProperties": false,
            "required": ["url", "steps"],
            "properties": {
              "url": {"type": "string"},
              "steps": {"type": "array", "items": {"type": "string"}}
            }
          }
        }
      }
    },
    "runtime_config": {
      "type": "array",
      "items": {
        "type": "object",
        "additionalProperties": false,
        "required": ["key", "label", "required", "description"],
        "properties": {
          "key": {"type": "string"},
          "label": {"type": "string"},
          "required": {"type": "boolean"},
          "default": {},
          "description": {"type": "string"}
        }
      }
    },
    "webhook": {
      "type": "object",
      "additionalProperties": false,
      "required": ["signature_scheme", "header", "setup", "receiver"],
      "properties": {
        "signature_scheme": {"type": "string"},
        "header": {"type": "string"},
        "events": {"type": "array", "items": {"type": "string"}},
        "setup": {
          "type": "object",
          "additionalProperties": false,
          "required": ["steps"],
          "properties": {
            "url": {"type": "string", "description": "The provider's setup PAGE."},
            "steps": {"type": "array", "items": {"type": "string"}}
          }
        },
        "receiver": {
          "type": "object",
          "additionalProperties": false,
          "required": ["required", "label", "provisioned_by"],
          "properties": {
            "required": {"type": "boolean"},
            "label": {"type": "string", "description": "The inbound URL the operator pastes INTO the provider (distinct from setup.url)."},
            "provisioned_by": {"type": "string", "enum": ["operator"]}
          }
        }
      }
    },
    "data": {
      "type": "object",
      "additionalProperties": false,
      "required": ["emits", "pii_posture"],
      "properties": {
        "emits": {"type": "array", "items": {"type": "string"}},
        "pii_posture": {"type": "string"},
        "redaction": {"type": "string"}
      }
    },
    "instructions": {
      "type": "array",
      "items": {
        "type": "object",
        "additionalProperties": false,
        "required": ["action", "text"],
        "properties": {
          "action": {"type": "string", "enum": ["open_url", "paste_secret", "oauth_consent", "register_webhook", "configure", "verify"]},
          "text": {"type": "string"},
          "link": {"type": "string"},
          "ref": {"type": "string", "description": "Citation back to the verified auth.md/references line. REQUIRED for open_url/register_webhook/configure (enforced by the validator)."}
        }
      }
    },
    "references": {
      "type": "array",
      "items": {
        "type": "object",
        "additionalProperties": false,
        "required": ["kind", "url"],
        "properties": {"kind": {"type": "string"}, "url": {"type": "string"}}
      }
    },
    "ingestion_gate": {
      "type": "object",
      "description": "Optional display hints for the Ingestion Gate UI. Presentational only — no review commands, governance policy, or secret storage. Bot-owned governance still controls review actions.",
      "additionalProperties": false,
      "required": ["source_type_label", "summary_fields", "evidence_labels", "empty_state"],
      "properties": {
        "source_title_template": {"type": "string", "description": "Template for the source row title in the Ingestion Gate UI; placeholders like {channel_name} are filled by the rendering layer from adapter-emitted fields."},
        "source_type_label": {"type": "string", "description": "Short noun for the evidence kind (e.g. 'Slack message', 'Devin session')."},
        "summary_fields": {"type": "array", "items": {"type": "string"}, "description": "Ordered adapter-emitted field names shown in the evidence summary row."},
        "evidence_labels": {"type": "object", "description": "Map of adapter evidence-kind keys to human display labels."},
        "empty_state": {"type": "string", "description": "Message shown when no evidence has been ingested from this source."}
      }
    },
    "wire_gates": {"type": "array", "items": {"type": "string"}},
    "live_readiness": {"type": "string", "description": "Human-readable implementation/wiring note only. It must not be interpreted as alpha admission, real-provider proof, terminal Bot proof, or human acceptance; those are tracked separately."}
  }
}
