{
  "id": "osv",
  "name": "OSV",
  "version": "0.1.0",
  "channel": "beta",
  "description": "OSV.dev open-source vulnerability records as redact-and-pass governed evidence (free unauthenticated query API; public technical vuln data).",
  "category": "security/compliance-evidence",
  "trust_tier": "T1",
  "status": "live-ready",
  "available": true,
  "modes": ["active"],
  "credentials": [],
  "runtime_config": [
    {
      "key": "query",
      "label": "Query scope (package / ecosystem / commit)",
      "required": true,
      "description": "What the operator runtime queries OSV.dev for — e.g. a package + ecosystem, a commit, or a purl. The live query client (POST /v1/query, /v1/querybatch, GET /v1/vulns/{id}) is operator-runtime."
    },
    {
      "key": "base_url",
      "label": "OSV API base URL",
      "required": false,
      "default": "https://api.osv.dev",
      "description": "Host the query client pins to (anti-SSRF). Default is the public OSV.dev API."
    }
  ],
  "data": {
    "emits": ["vulnerability"],
    "pii_posture": "OSV records are PUBLIC technical vulnerability data (CVE/GHSA ids, package names, severity scores). The free-text summary + details are redact-and-passed (secret/PHI/PAN + email/phone scrubbed) for parity -- a description can embed a contributor email or a tokened URL, and redaction is non-destructive. The opaque vuln id floor is NOT redacted; severity/packages/aliases metadata is technical. No person attribution (no author field). FX-SEC-001 hard-screens secret/PHI/PAN as the un-bypassable backstop.",
    "redaction": "redact-and-pass (summary + details); opaque id floor un-redacted; technical metadata kept; no author; FX-SEC-001 rejects secret/PHI/PAN"
  },
  "instructions": [
    {
      "action": "configure",
      "text": "Set the operator runtime's OSV query scope (package + ecosystem, commit, or purl) and confirm the API host pin. There are no credentials -- OSV.dev is free and unauthenticated.",
      "ref": "connectors/osv/auth.md (OSV Auth)"
    },
    {
      "action": "verify",
      "text": "Test the connection: a query for a known-vulnerable package should return one or more emissions (summary + details redact-and-passed; opaque vuln id floor)."
    }
  ],
  "references": [
    {"kind": "api", "url": "https://google.github.io/osv.dev/api/"},
    {"kind": "schema", "url": "https://ossf.github.io/osv-schema/"},
    {"kind": "auth", "url": "connectors/osv/auth.md"}
  ],
  "wire_gates": [
    "OSV schema re-verified live 2026-06-13 (ossf.github.io/osv-schema): id+modified required, all else optional; summary/details free-text, severity[{type,score}], affected[].package.name, references[].url, aliases[] -- every field parse_vuln reads MATCHES. No drift.",
    "PII: summary + details redact-and-passed (secret/PHI/PAN + email/phone); opaque vuln id floor un-redacted; technical metadata kept; no author. OSV is public data. FX-SEC-001 backstops secret/PHI/PAN.",
    "The live OSV.dev query client (POST /v1/query, /v1/querybatch, GET /v1/vulns/{id}) is operator-runtime; no live network this cycle. Live flip gated on operator review + a real query against the public API (ADR-0012)."
  ],
  "live_readiness": "Flip-ready, NOT yet Live. Parse + redact-and-pass are built and harness-proven; summary/details redact-and-passed, opaque vuln id floor. No credentials (free unauthenticated API). Gated on operator review + wiring the live query client (host-pinned to api.osv.dev) to a GatewaySink. To flip: set the query scope; wire the runtime query client; run a real query; review before promoting."
}
