{
  "id": "devin",
  "name": "Devin",
  "version": "0.1.0",
  "channel": "beta",
  "description": "Devin agentic-coding sessions (v3 enterprise API) as redacted, governed evidence.",
  "category": "developer-ai",
  "trust_tier": "T1",
  "status": "live-ready",
  "available": true,
  "modes": ["active"],
  "credentials": [
    {
      "key": "devin",
      "type": "api_key",
      "label": "Service-User API key",
      "required": true,
      "modes": ["active"],
      "header": "Authorization: Bearer <cog_ Service-User key>",
      "validation": "^cog_[A-Za-z0-9]+$",
      "obtain": {
        "url": "https://docs.devin.ai/api-reference/authentication",
        "steps": [
          "In your Devin organization settings, create a Service-User API key (cog_ prefix). It is shown once at creation and is RBAC-scoped; a Personal Access Token works too where available.",
          "Copy the key — it is sent as an Authorization: Bearer header. Devin publishes no webhooks, so this is the only credential (active poll only)."
        ]
      }
    }
  ],
  "runtime_config": [
    {
      "key": "base_url",
      "label": "Sessions endpoint base URL",
      "required": true,
      "description": "The v3 sessions list endpoint with your org templated in: https://api.devin.ai/v3/organizations/<org_id>/sessions (host pinned api.devin.ai; org_id goes in the path). Consumed by runtime build_devin_spec(base_url=...); there is no default (the operator supplies org_id)."
    }
  ],
  "data": {
    "emits": ["session"],
    "pii_posture": "Session free-text (title, structured_output, message trail) may carry secrets/PII, so it is passed through adapter.core.redaction.redact (redact-and-pass) before emit; the first pull_requests[].pr_url is kept un-redacted as the artifact location (github/gitlab/jira precedent). FX-SEC-001 producer screen is the un-bypassable backstop.",
    "redaction": "redact-and-pass (free-text scrubbed of secret/PHI/PAN + email/phone; FX-SEC-001 is the hard backstop)"
  },
  "instructions": [
    {
      "action": "open_url",
      "text": "Create a Service-User API key (cog_) in your Devin organization settings.",
      "link": "https://docs.devin.ai/api-reference/authentication",
      "ref": "connectors/devin/auth.md (Expected secret keys)"
    },
    {
      "action": "paste_secret",
      "text": "Paste the Service-User API key (sent as Authorization: Bearer <key>)."
    },
    {
      "action": "configure",
      "text": "Provide the v3 sessions base URL with your org id templated in: https://api.devin.ai/v3/organizations/<org_id>/sessions.",
      "ref": "connectors/devin/auth.md (Live path — reference poll client)"
    },
    {
      "action": "verify",
      "text": "Test the connection: an active poll should return recent sessions as redacted evidence (one emission per session)."
    }
  ],
  "references": [
    {"kind": "api", "url": "https://docs.devin.ai/api-reference/overview"},
    {"kind": "auth", "url": "https://docs.devin.ai/api-reference/authentication"},
    {"kind": "sessions-v3", "url": "https://docs.devinenterprise.com/api-reference/v3/sessions/organizations-sessions"}
  ],
  "ingestion_gate": {
    "source_title_template": "Devin: {session_title}",
    "source_type_label": "Devin session",
    "summary_fields": ["session_title", "session_status", "pr_url"],
    "evidence_labels": {
      "session": "Session",
      "pr_url": "Pull request"
    },
    "empty_state": "No Devin evidence has produced candidates yet."
  },
  "wire_gates": [
    "The operator templates org_id into the REQUIRED base_url (https://api.devin.ai/v3/organizations/<org_id>/sessions); build_devin_spec has no default base_url, so a missing value fails closed (ConfigError) before any request.",
    "v3 contract (items envelope; pull_requests[] of {pr_url, pr_state}; cursor end_cursor/has_next_page re-sent as ?after=; Bearer cog_ Service-User key) was doc-verified 2026-06-08 and re-verified live 2026-06-11 (docs.devinenterprise.com) — but UNVERIFIED against the live API with a real cog_ key. The operator must run the live poll and review the result before promoting to Live (ADR-0012).",
    "This connector targets the v3 ENTERPRISE API (docs.devinenterprise.com). The parallel v1 API (docs.devin.ai: GET /v1/sessions, `sessions` envelope, singular `pull_request`, limit/offset, apk_ keys) is the 2026-06-08-corrected drift shape — do NOT cite or wire it (SG-2026-06-11-A)."
  ],
  "live_readiness": "Flip-ready, NOT yet Live. Parse + redaction surface and the live fetch-half (build_devin_spec, runner-wired) are code-complete and harness-proven against a reference sink — but still incomplete: the Live flip is gated on operator human review + a live poll against the real Devin v3 enterprise API with a real Service-User (cog_) key. To flip: provide the api key + the org-templated base_url; wire GatewaySink; run the live poll; review before promoting to Live."
}
